,Date,News
42,2010-07-08,"Opening a Big Store in China, Apple Remains a Market Underdog : With a new flagship showroom about to open, the company is striving to overcome price disadvantages and an underground market.Chatting With Google: China, Apple and More : In an Allen & Company conference chock-full of assorted media moguls, it seems there's one thread unifying them all: Google.Smartphone Patent Suits Challenge Big Makers : NTP charges that the cellphone e-mail systems of the companies are illegally using its patented technology.'Saturday Night Live' Breaks an Emmy Record, and Lorne Michaels Is Cool With That : ""We've run longer than most television critics,"" Mr. Michaels said of ""Saturday Night Live,"" which has racked up a total of 126 Emmy nominations since its debut in 1975.Chapter by Chapter : These are the participating galleries. Addresses are on the Lower East Side unless otherwise noted. More information: lushlifeles.com.     SUE SCOTT GALLERY Chapter 1: ''Whistle,'' through July 31, 1 Rivington Street, at Bowery; (212) 358-8767, su...&#8216;Saturday Night Live&#8217; Breaks an Emmy Record, and Lorne Michaels Is Cool With That : &#8220;We&#8217;ve run longer than most television critics,&#8221; Mr. Michaels said of &#8220;Saturday Night Live,&#8221; which has racked up a total of 126 Emmy nominations since its debut in 1975.June Sales Were Tepid at Low End and High : Retail sales rose 3.1 percent in June compared with June of last year, slightly lower than estimates compiled by Thomson Reuters.Lots of Twitter Speculation, if Not Proper Punctuation : Across Twitter, users — including N.B.A. All-Stars and sports celebrities — speculated where LeBron James would decide to sign.Media Executives Flock to Sun Valley Conference : Moguls like Warren Buffett and the founders of Google are in Idaho this week for the Sun Valley Conference.TV on a PC or Phone Has Some Drawbacks : On the Internet, some episodes of shows are available only for a fee, and other shows are not available at all. Clicker.com can help you sort it all out."
43,2010-07-09,"Opening a Big Store in China, Apple Remains a Market Underdog : With a new flagship showroom about to open, the company is striving to overcome price disadvantages and an underground market.Chatting With Google: China, Apple and More : In an Allen &#038; Company conference chock-full of assorted media moguls, it seems there&#8217;s one thread unifying them all: Google.Apple Still Underdog in China, Despite New Store : With Apple set to open a flagship showroom on Saturday in Shanghai &#8212; one of its largest stores in Asia &#8212; the company is making a new push to tap into the world&#8217;s biggest mobile phone market and grab a bigger share of China&#8217;...Apple Still Underdog in China, Despite New Store : With Apple set to open a flagship showroom on Saturday in Shanghai -- one of its largest stores in Asia -- the company is making a new push to tap into the world's biggest mobile phone market and grab a bigger share of China's fast-growing consume...Turning the Page on the Page Turn : Microsoft hopes to patent the digital equivalent of a page turn, but it might not be the most efficient way to read on a digital screen.Morning Take-Out : And in Today's Morning Take-Out:1. Calling all angel investors2. Sovereign debt unpicked3. BP invite you to roll the diceMorning Take-Out : And in Today&#8217;s Morning Take-Out: 1. Calling all angel investors 2. Sovereign debt unpicked 3. BP invite you to roll the diceSmartphone Patent Suits Challenge Big Makers : NTP charges that the cellphone e-mail systems of the companies are illegally using its patented technology.Chapter by Chapter : These are the participating galleries. Addresses are on the Lower East Side unless otherwise noted. More information: lushlifeles.com.     SUE SCOTT GALLERY Chapter 1: ''Whistle,'' through July 31, 1 Rivington Street, at Bowery; (212) 358-8767, su...Smartphone Patent Suits Challenge Big Makers : NTP, a patent-holding company best known for prying a settlement of more than $600 million from the maker of the BlackBerry, is suing the other big names in the smartphone industry: Apple, Google, Microsoft, HTC, LG and Motorola."
44,2010-08-09,"Executive Leaves Apple After iPhone 4 Problems : Mark Papermaster, the Apple executive in charge of hardware for the company's flagship iPhone, has left the company in the wake of widely reported problems with the antenna of the recently introduced iPhone 4.     Apple confirmed Mr. Papermaster's...Android Phones Outpace Apple's : By the end of 2011, there could be more smartphones in the United States than the less advanced  feature phones, according to a report released Monday by the Nielsen Company, a market trends monitor.     The report also notes that the Google Andro...Docks for Apple Gadgets Help a Business Thrive : SDI Technologies, an innovator since the 1950s when it made transistor radios, has flourished by making the iHome brand of products.App Smart Extra: Restricted Diets : Vegetarians and other people with special dietary needs can find apps to find them food.Oracle Chief Faults H.P. Board for Forcing Hurd Out : Lawrence Ellison, the head of Oracle, said Hewlett-Packard’s decision to remove Mark Hurd was not in the best interest of “employees, shareholders, customers and partners.”Oracle Chief Faults H.P. Board for Forcing Hurd Out : Lawrence Ellison, the head of Oracle, said Hewlett-Packard's decision to remove Mark Hurd was not in the best interest of ""employees, shareholders, customers and partners.""Oracle Chief Faults H.P. Board for Forcing Hurd Out : Lawrence Ellison, the head of Oracle, said Hewlett-Packard&#8217;s decision to remove Mark Hurd was not in the best interest of &#8220;employees, shareholders, customers and partners.&#8221;What We're Reading: History Lessons : Lessons to learn from Etsy, Twitter's P.R., mobile wars and a lot of books are all on the reading list.Schoolteachers Driving Cadillacs : Living high on state salaries?The Early Word: Trailblazer to Fund-raiser : The president travels to Texas to push his education plan and to raise funds for Democratic senate candidates."
45,2010-08-19,"Getting a Refund From the App Store : Some tips for making an app work on your Apple gadget, and ways to try to get your money back if none of them are successful.A Docking Station From iLuv Offers a Nod to the Past : In my recent article about iHome, the largest manufacturer of  iPhone/iPod speaker docks, I pointed out that Apple's strict design regulations make it easier for accessories makers to create products, secure in the knowledge that they won't quickl...An iPad Book for the Deaf : ""Danny the Dragon Meets Jimmy"" is said to be the first iPad book app for deaf children. But it could have been so much more.For Digital Artists, Apps Provide New Palette : The advent of mobile devices with touch screens and tilt sensors is changing some artists’ approach to art.People Magazine Subscribers to Receive Free Access on iPads : The arrangement is a first step toward what Time Inc. hopes is a model for the bundling of print and digital sales for all its publications.Should a Profitable Company Demand Pay Cuts? : The company asserts that the givebacks are warranted because the plant's labor costs are excessive compared to average wages in the region.House Tour: Livingston, N.Y. : In Columbia County two architects modernize a cottage and add an extension, creating 2,500 square feet of getaway space.Access to Healthy Foods : A reader responds to an article about doctors prescribing healthy food.Flood Brings Chaos Back to Pakistan’s Swat Valley : Floods shattered hopes where residents had just began rebuilding after troops drove the Taliban into hiding.With McAfee Deal, Intel Looks for Edge : With the $7.68 billion acquisition Intel becomes a major player in the security software and services market."
46,2010-08-20,"For Digital Artists, Apps Provide New Palette : The advent of mobile devices with touch screens and tilt sensors is changing some artists’ approach to art.People Magazine Subscribers to Receive Free Access on iPads : The arrangement is a first step toward what Time Inc. hopes is a model for the bundling of print and digital sales for all its publications.House Tour: Livingston, N.Y. : In Columbia County two architects modernize a cottage and add an extension, creating 2,500 square feet of getaway space.Flood Brings Chaos Back to Pakistan’s Swat Valley : Floods shattered hopes where residents had just began rebuilding after troops drove the Taliban into hiding.With McAfee Deal, Intel Looks for Edge : With the $7.68 billion acquisition Intel becomes a major player in the security software and services market.Math Lessons for Locavores : Eating locally grown produce is a fine thing in many ways. But it is not an end in itself, nor is it a virtue in itself.The Lights of Big Brother’s Eyes, Blinking in the City : An Orwellian theme is handled deftly in an exhibition at the Austrian Cultural Forum, with works as nuanced and versatile as they are on-message.Mario Obledo, Hispanic Rights Leader, Dies at 78 : Mr. Obledo was a founder and leader of major Hispanic-American organizations and served as California’s secretary of health and welfare.Spare Times : A selected guide to events, outdoors and indoors, in New York."
47,2010-08-24,"Apple Said to Seek Show-Rental Deal : The News Corporation and the Walt Disney Company are said to be close to deals for iTunes rentals at 99 cents a TV episode.Q. & A.: Dealing With Apple App Lemons : It is pretty hard to get a refund for buggy iPhone or iPad apps. Here's the best method.Financial Research? There's an App for That : Morgan Stanley on Monday became the first Wall Street firm to launch an application for its financial research in Apple's App Store.Financial Research? There&#8217;s an App for That : Morgan Stanley on Monday became the first Wall Street firm to launch an application for its financial research in Apple&#8217;s App Store.Desert Dwellers on a Fast-Food Diet : A Brooklyn artist has given red harvester ants, Pogonomyrmex badius, an all-McDonald’s menu.Tuesday Reading: The Egg Recall's Impact : The impact of the egg recall, one plan for tax cuts and other consumer-focused items from Tuesday's Times.A School Fight Over Chocolate Milk : Flavored milk has emerged as both villain and victim in a cafeteria drama that pits the dairy industry, administrators and parents against one another.Plein Sud and Wall & Water : Though camera-ready, the food at Plein Sud, a small bistro off the lobby of the Smyth Hotel, lacks flavor; the modest menu at Wall & Water, at the Andaz Hotel, is a delightful surprise.Inside the Times : International     14 DIE IN PLANE CRASH  Radiation, Risks Are Focus of Breast Screening Studies : Doctors have expressed concerns about relying too much on breast imaging exams that expose women to far higher doses of radiation than regular mammography."
48,2010-08-25,"The Apple Guessing Game Commences : Is Apple going to announce new iPods, a deal with the Beatles, iTunes in the cloud, or an updated Apple TV at a media event next month?Apple Said to Seek Show-Rental Deal : The News Corporation and the Walt Disney Company are said to be close to deals for iTunes rentals at 99 cents a TV episode.Apple Invites News Media to Sept. 1 Event : Apple invited reporters to an event in San Francisco, but said nothing about what it planned to announce.New Kindle Leaves Rivals Farther Back : Too bad there's not a reality TV show called ''America's Most Freaked-Out Tech-Company Meetings,'' where you  watch classic panicked board meetings. For example,  when the Apple employee left an iPhone 4 prototype in a bar. Or when Intel learned t...Took a Bad Photo? Paint, Sketch or Distort It, Beautifully : A variety of effects may help you escape with art of a different sort, or at least a laugh.New Kindle Leaves Rivals Farther Back : Amazon introduces an e-book reader that everyone (except Amazon) calls the Kindle 3. It’s a response to the iPad, with improved E Ink screen technology.Putting Color in an E-Reader (and Free Books, Too) : Dedicated e-readers, like Amazon's Kindle, Barnes & Noble's Nook and Sony's Reader, have one thing in common: they all use black-and-white screen technology from a company called E Ink.     Not that E Ink wouldn't like to be able to offer color, b...Using a Fingerprint Scanner on Your Laptop : These readers let you replace a typed password with a finger swipe across a sensor, but they can be finicky.Color Comes to an E-Reader : A new low-cost e-reader hopes to grab market share n part to its use of a full-color LCD screen.Tech Talk Podcast: The Facebook Movie : On this week’s Tech Talk podcast, the Facebook movie and Facebook’s Places service are discussed."
49,2011-02-07,"The Odds of Picking the Next Apple : The odds are insanely low, but we read so much about the next hot stock that we think we can beat the odds.Paid Notice: Deaths  SLIFKA, ALAN B. : SLIFKA--Alan B.,a prominent New York investment manager and philanthropist died on Friday, February 4, 2011 at home after a battle with cancer. Mr. Slifka is survived by his beloved wife Riva Ariella Ritvo-Slifka, his sister Barbara Slifka, his ch...Super Bowl Ads Mine Decades of Americana : The Super Bowl ads dished up a dizzying mélange of star turns, movie references, homages to television shows, snippets of songs and even hat-tips to other spots.What Are Your Favorite Commercials? : Student Opinion | Are you ever moved by advertising to buy a product or service?Intel Chip Flaw Causes Delays : Computer makers have been forced to shut down some of their assembly lines because of a design flaw in chips produced by Intel.     Dell and Hewlett-Packard have both stopped producing several models of personal computers to await a modified versi...Over Caviar, Talk of Gogol's Bowels : What would Gogol eat?     The guests chewed over that question on Friday night as they sampled the pig's tongue slivers, the blinis with caviar, the headcheese and the smoked sardines.  Yahoo Is Said to Move Toward Personalized Content : A new platform being built by Yahoo is meant to take advantage of the growth in tablets and smartphones.Curtain Down, Heads Up: Readers Review 'Three Sisters' : A roundup of readers' reviews of ""Three Sisters"" at the Classic Stage Company.Restaurant Nutrition Draws Focus of First Lady : As part of her effort to influence diet, Michelle Obama hopes to prod restaurants toward healthier offerings.Real vs. Virtual: Examining Works of Art Online : Lesson Plan | A dozen activities for using Google's Art Project to explore major works of art."
50,2011-05-05,"App Smart Extra: Golf Apps : A new golf app from Jack Nicklaus shakes up the field.A Tool to Harvest iPhone Location Data : The New York Times Company’s Research and Development Lab released a free Web-based tool that creates an research database of anonymized location data from iPhones and iPads.To Improve Your Swing: Bend Your Knees and Find a Good App : Golf-related apps have been around awhile, but the lineup has improved significantly with time.Gadgets to Ease Travails of Travel : Travel gadgets have become smaller, more powerful and less expensive.Mobile Booking Apps Are Only Just Starting to Deliver : Mobile apps are starting to appear that let users make reservations and manage a host of other travel details.Q&A: Displaying the Mac's Screen on an HDTV : How to connect your Mac to a high-defintion TV via an HDMI cable.Friday: Where Buzz Cola Is Sold : A fun Friday by Natan Last.An Inside Take on the British Invasion : In his autobiographical show at Feinstein’s, Peter Asher, the Peter of Peter and Gordon, tells tales of his life at the center of the British music scene in the 1960s.Tater Tots? At Prep Schools, Try the Rutabaga Fries : In New York City, private school lunches are offering fare like steak and blue cheese tossed with dandelion greens, rutabaga fries and locally sourced, grass-fed beef.To Enhance Chip Speed, Intel Enters 3rd Dimension : HILLSBORO, Ore. -- Intel announced on Wednesday that it had again found a way to make computer chips that could process information more quickly and with less power in less space.     The transistors on computer chips -- whether for PC's or smartp..."
51,2011-05-13,"Trade Ruling Favors Kodak in Dispute With Apple : The United States International Trade Commission, in a preliminary ruling, rejected Apple’s digital-camera patent claims against the Eastman Kodak Company.On the Lookout for an Amazon Tablet : It has been nearly a year since Amazon announced a new Kindle product, but Jeff Bezos, the company’s chief executive, dropped a hint that a “multipurpose tablet device” could be on the way.A Grandma by Any Other Name : Apple and Moses use “Lalo.” Ryder calls Goldie “Glam-Ma.” How about yours?Netflix Is Available for Some Android Devices, but Not All : Netflix’s streaming app is now available for some Android devices, but the fact that only some Android phones get the latest features and others do not is a continuing problem for Google.An Ailing Killebrew Simply Says Farewell : Harmon Killebrew issued a modest farewell on Friday in which the slugger of 573 home runs said his battle against esophageal cancer had come to an end.Taste of China Not as Far East: Egyptian Wing at the Met : A gala at the Metropolitan Museum of Art celebrated links between China and the United States.New Ways to Exploit Raw Data May Bring Surge of Innovation, a Study Says : Data is a vital raw material of the information economy, but the business world is just beginning to learn how to process it all."
52,2011-06-03,"Apple Said to Be Near Deal for Music Rights : Apple has nearly completed its negotiations with the major music publishers over rights for a new cloud music service.     Of the four big publishers, two have signed deals with Apple, and the others will most likely complete their deals in coming...Apple Patents Way to Prevent Concert Piracy : A new patent filed by Apple could help the music and movie industries thwart copyright violation by disabling mobile phone cameras that try to record concerts and movies.Worth Reading: The Mouse Is Dead : The next edition of Windows may doom the mouse.Tip of the Week: Seeing the Forest for the Windows : Need to find a certain open window on your desktop — but you cannot fully see it in the clutter of other open windows on the screen? Both Windows 7 and Mac OS X include features that help you focus quickly on the one window you need.Statements Skip Over REIT’s Woes : Apple REIT Eight, a real estate investment trust that owns hotels, issues comforting account statements, but its latest quarterly report contains some unsettling red flags.Inside The Times : International     CALLS AGAINST CORRUPTION  Tetris Expands Beyond Gaming, and Claims a New Record : The Tetris Company, the maker of the game Tetris, claimed on Friday that the game broke a record after people paid for and downloaded it 132 million times on mobile devices.How Football Players Got Trounced by ‘Glee’ : “Friday Night Lights” is a TV show about teenagers, high school and teamwork. So is the musical dramedy. But only one of these shows became a huge hit. And not the one that deserved to be.Olympic Gold, or the Stanley Cup? : Which is the more coveted prize in hockey, the Stanley Cup or Olympic gold medal?"
53,2011-06-15,"Apple’s Hype Envelops Penney : J. C. Penney’s share price took an unwarranted climb on Tuesday when it said it had hired Ron Johnson of Apple to eventually run the company.Nokia Settles 2-Year Fight With Apple on Patents : Apple agreed to make a one-time payment to Nokia and to pay regular royalties in the future to license some of Nokia’s patents.Apple Stores Chief to Take the Helm at J.C. Penney : J.C. Penney hopes that Ron Johnson, a man who rethought how to sell computers, can also rethink how to sell clothes, cosmetics and accessories.Leather Tech : THE J. W. Hulme Company of St. Paul has been making high-quality leather and canvas goods since 1905. For a company best known for its outdoorsy bags for sport hunters, its newest undertaking, part of its American Heritage collection, is downright...A Tool to Help Secure Your Browser : A new free tool for consumers from Qualys called BrowserCheck makes sure your browser (and its plug-ins) are as up-to-date and protected from malware as possible.Sony Makes Music Service Available on Android : Sony plans music anywhere a user has an Internet connection.Shopping Snapshots for June 16 : J. W. Hulme of St. Paul now offers Apple accessories like iPhone and iPad cases, nautically striped rompers and other items.Where Others Have Gone Without Success, J.C. Penney Goes Again : With a new chief executive, J. C. Penney is setting out to rethink the shopping experience.Weird Al Gets Weird App : Weird Al Yankovic continues to find his way into the hearts and minds of America's youth, and this time there's nothing that Lady Gaga can do to stand in his way. On Wednesday, HarperCollins Children's Books said an application would be released f...For His Children’s Book, Weird Al Gets a Weird App : The application, based on Mr. Yankovic’s book “When I Grow Up,” offers young readers the opportunity to practice fanciful future occupations like shaving a tarantula or massaging a gorilla."
54,2011-06-16,"Facebook Readies an iPad App, Finally : More than a year after the iPad went on sale, there is still no official Facebook app for it. That is about to change.Leather Tech : THE J. W. Hulme Company of St. Paul has been making high-quality leather and canvas goods since 1905. For a company best known for its outdoorsy bags for sport hunters, its newest undertaking, part of its American Heritage collection, is downright...Tech Talk Podcast: Adding Addresses to the Internet : Expanding the Internet; finding free music, books and movies; news.Where Others Have Gone Without Success, J.C. Penney Goes Again : With a new chief executive, J. C. Penney is setting out to rethink the shopping experience.RIM Profit Falls Below Estimates : Research in Motion’s stock declined 15 percent in extended trading after a poor earnings report and a second reduction this year in its forecast.Robin Williams’s Personal Legend of Zelda : The comedian and his daughter, Zelda, whom he named after a certain popular video game character, appear in a commercial for a new Nintendo video game.Hispanics Rank High on Digital Divide : The gap between computer haves and have-nots is particularly wide among Hispanics, and in the Bay Area some private groups are trying to reduce it.Weird Al Gets Weird App : Weird Al Yankovic continues to find his way into the hearts and minds of America's youth, and this time there's nothing that Lady Gaga can do to stand in his way. On Wednesday, HarperCollins Children's Books said an application would be released f...Guides for the Casual Movie Buff and Dedicated Cinephile : Many movie apps are good but not perfect. Flixster, for example, can help you choose films and find nearby theaters, but often cannot be used to buy a ticket directly.Excited About the Cloud? Get Ready for Capped Data Plans : The tech world is in the middle of the “cloud” wave, but its potential could be complicated by another looming trend — plans that cap how much data you can use through your home broadband connection."
55,2011-06-24,"Apple Sues Samsung in South Korea Over Patents : Apple filed a patent lawsuit against the Samsung Electronics Company in South Korea, claiming that Samsung’s Galaxy line of smartphones and tablet computers copies its iPhone and iPad devices.The Quarrel Over Final Cut Continues : The quarrel between Apple and professional video editors over the new version of Final Cut Pro continues.Corrections : ARTS & LEISURE     A cover essay this weekend about the online storage of music misstates the name of the Apple service that will scan and recognize music and add Apple's own copies without uploading. It is iTunesMatch, not iMatch.              Corrections : Corrections appearing in print, June 25, 2011.Two Are Accused of Stealing $16 Million Over Eight Years : A bookkeeper for two small, family-run businesses in SoHo allegedly used company checks to funnel money into a bank account her son controlled.Morning Take-Out : Highlights from the DealBook newsletter.Morning Take-Out : Highlights from the DealBook newsletter.Let It Rain! The Dark Side of Summer : The somber colors and covered-up styles of the summer 2012 men's shows in Paris seem to echo Europe's dreary weather.Like Living, Only More So : Ryan Trecartin’s “Any Ever” is a game-changing exhibition of videos and installation art that teeters giddily at the intersection of art, reality television and social networking.Spare Times for June 24-30 : A selected guide to walks, talks, exhibitions and other events in New York."
