,Date,News
28,2009-04-20,"Footnotes : The Big Apple Circus has renewed its agreement with Lincoln Center for the Performing Arts and more culture news.Owner of Monitor Company Says Mac Displays Are Real : Despite a connection to a less-than-productive Internet salesman, the maker of a new Apple-compatible display insists his product is not vaporware.Are You Ready for Some Product Placement? : In its biggest sports installation to date, Sony is equipping the new Dallas Cowboys stadium with more than 3,000 LCD TVs.LOOKING AHEAD : ECONOMIC DATA Reports include leading economic indicators for March (Monday); existing-home sales for March (Thursday); and durable goods and new-home sales for March (Friday).     CORPORATE EARNINGS Reports will come from Bank of America, Boston ...He Left His Teeth Next to the Marionette : Blogtalk: A window full of curious attractions; a dome for Midtown Manhattan; custom toilet paper from Michel Gondry; revisiting a block photographed by Walker Evans; and more New York links.He Left His Teeth Next to the Marionette : Blogtalk: A window full of curious attractions; a dome for Midtown Manhattan; custom toilet paper from Michel Gondry; revisiting a block photographed by Walker Evans; and more New York links.Adobe in Push to Spread Web Video to TV Sets : Adobe expects TVs that support its Flash format to start selling later this year, offering content creators a single format for an expanding ecosystem of digital devices.Marijuana Advocates Point to Signs of Change : Advocates of legalizing marijuana are sensing increasing acceptance of the drug, as medicine or entertainment.Google News, and More, on a Timeline : Google News Timeline, a new experimental product, gives users powerful new ways to scan stories and more over time.Aerodynamics on Land: Aiming for 800 M.P.H. : A group of volunteers intends to take a modified fighter jet to the hardpan desert at Black Rock, Nev., to set a land speed record."
29,2009-10-12,"Google and Apple Eliminate Another Link Tie : The Federal Trade Commission is no longer pursuing its inquiry into the two companies’ connections.Apple's App Refund Policy: No : Apple does allow refunds for apps, which may hamper the sale of expensive apps.Disney’s Retail Plan Is a Theme Park in Its Stores : The Walt Disney Company, with the help of Steve Jobs, intends to alter its approach to the shopping mall.Ben Williams, Circus Performer Whose Co-Star Was an Elephant, Dies at 56 : Mr. Williams seized the attention of Big Top crowds by fearlessly and flamboyantly cavorting under, above and around elephants.Levinson Leaves Google Board Amid F.T.C. Inquiry : Arthur D. Levinson has left Google's board amid an investigation by federal regulators into the ties between the boards of Google and Apple.The Collider, the Particle And a Theory About Fate : One of the most bizarre theories in all of science suggests a negative outcome for the superconducting supercollider in Switzerland.The Collider, the Particle and a Theory About Fate : One of the most bizarre theories in all of science suggests a negative outcome for the superconducting supercollider in Switzerland.The Potential Perils of M.&A., Phone Edition : One of the longstanding criticisms of mergers and acquisitions is that it destroys shareholder value. To some, Microsoft's purchase of Danger, the maker of the popular Sidekick phone for T-Mobile, did even more damage.Two Daily Newspapers Fighting Over Top Spot : Will circulation declines at USA Today mean The Wall Street Journal is bigger? Depends on who is doing the counting.The Beauty in Redundancy : The T-Mobile Sidekick data-loss problem gives a lesson in the importance of multiple back-ups."
30,2009-10-13,"Google and Apple Eliminate Another Link Tie : The Federal Trade Commission is no longer pursuing its inquiry into the two companies’ connections.Disney’s Retail Plan Is a Theme Park in Its Stores : The Walt Disney Company, with the help of Steve Jobs, intends to alter its approach to the shopping mall.Dining Calendar : Prix Fixe Dinners.Levinson Leaves Google Board Amid F.T.C. Inquiry : Google said Monday that Arthur D. Levinson, the former chief executive of Genentech, is leaving its board of directors.Playfully Flavored Cannoli : The restaurant owner Anthony Fontana is selling flavored variations of cannoli at a new store.The Collider, the Particle And a Theory About Fate : One of the most bizarre theories in all of science suggests a negative outcome for the superconducting supercollider in Switzerland.Ben Williams, Half of an Elephant Act, Dies at 56 : Ben Williams, who, clad only in his trademark tiger-skin loincloth, seized the attention of Big Top crowds by fearlessly and flamboyantly cavorting under, above and around elephants to become one of the top circus attractions of recent decades, di...Nokia's Netbook Comes With Marathon Battery Life : Nokia enters the netbook PC market with the Booklet 3G. In addition to 3G data connectivity, the machine boasts a 12-hour battery life -- much longer than the competition.BlackBerry, Upgraded, Aims to Suit Every User : The Storm was supposed to be the smartphone that would keep Verizon Wireless customers from deserting to Apple’s iPhone, which runs on AT&T’s network.New Knits Are Flexible Friends : Woolly, hairy or feather light, autumn knits have one thing in common: They cover the body like falling leaves."
31,2009-11-02,"Accounts, People & Miscellany : Accounts, People & MiscellanyAccounts, People & Miscellany : Accounts          United Parcel Service, Atlanta, chose Ogilvy & Mather Worldwide, New York, part of WPP, to handle its worldwide account, with spending estimated at $200 million. The assignment had been divided among various agencies that include...Performa 09 | Food for Thought : It took the Biblical God seven days to make a new world. All the party designer Jennifer Rubell needed was Friday night. To benefit Performa 09, the three-week biennial of performance art under way on stages all over town, Rubell's creation story ...Performa 09: In the Beginning, an Old Testament Feast : The opening party for the performance art biennial was modestly titled &#8220;Creation&#8221;; it melded installation art, happenings and performance art with various Old Testament overtones.Performa 09: In the Beginning, an Old Testament Feast : The opening party for the performance art biennial was modestly titled ""Creation""; it melded installation art, happenings and performance art with various Old Testament overtones.Answers About Investor Behavior : A financial planner answers questions about the impact of human behavior on investing.Libraries Imagined : This weekend, co-vocabularists have challenged the legacy of Melvil Dewey by stocking and stacking imaginary libraries according to whimsical classifications.It Knows Where You Are, and What You’re Looking For : Loopt is now entering the crowded field of applications that allow users to search for surrounding businesses and events from a mobile phone.Business Is a Beat Deflated : So you might expect the business press to be striking up the band and restocking the cigar cabinet. But the business of covering business may never really come back."
32,2010-03-22,"Overseeing Apple Prototypes : Apple has hired Richard DeVaul, a veteran of the wearable computing field and co-founder of Aware Technologies, a company focused on creating fitness and health products. According to Computerworld, Mr. DeVaul will be a senior prototype scientist ...Apple Adds 2 Publishers to Its Store for E-Books : Perseus Books Group and Workman Publishing Company, both independent publishers, signed deals with Apple to sell electronic versions of their books on the iPad.Rush Is On to Be First in iPad Apps : Though the iPad won’t be out until April 3, lots of software developers are looking for the first-out advantage.Perseus Signs an EBooks Deal for the iPad : Perseus Books Group signs an e-book deal with Apple's iPad.Perseus Signs an E-Books Deal for the iPad : Apple has signed a deal with the largest distributor of independent publishers to sell electronic versions of it books on the new device, report Motoko Rich and Brad Stone on Media Decoder.Digitally, Location Is Where It&#8217;s At : Location-based services like Foursquare and Gowalla were the talk of the South by Southwest Music and Media Conference in Austin, Tex.Paid Notice: Deaths  FOUST, EVERETT ""ALAN"" AGE 64 : FOUST--Everett ""Alan"" age 64, of Leonia for 25 years, on March 20, 2010. He is survived by his wife of 38 years Catherine nee: Eardley. Devoted father to Cynthia and her husband Ronald Venner. His adored grandson Liam. Dear brother to Dr. Andrea W...Where to Satisfy a Sweet Tooth in Hong Kong : Finding a good, authentic croissant in Hong Kong has gotten a little easier. Bakeries in the city are still mostly dominated by chains, but several unique spots have been shaking up the scene, particularly a handful of spots specializing in tradit...Where to Satisfy a Sweet Tooth in Hong Kong : Finding a good, authentic croissant in Hong Kong has gotten a little easier. Bakeries in the city are still mostly dominated by chains, but several unique spots have been shaking up the scene, particularly a handful of spots specializing in tradit...The Brooklyn Flea Will Stay at One Hanson, Along With Some New Food Vendors : The market, which operated in the old Williamsburgh Savings Bank Tower on weekends this winter, will stay there on Sundays starting in April."
33,2010-03-23,"Apple Adds 2 Publishers to Its Store for E-Books : Perseus Books Group and Workman Publishing Company, both independent publishers, signed deals with Apple to sell electronic versions of their books on the iPad.Yahoo Offers New iPhone Search Applications : Yahoo announced two new mobile search applications for the Apple iPhone, including one that allows users to draw a boundary on a map to bring up localized content.Opera Mini Browser, Coming to an iPhone Near You : Opera Software on Tuesday announced the Opera browser for the iPhone.Two New Travel Apps for the iPhone: NileGuide and Gliider : Two popular sites for travel information have devised versions for Apple's iPhone that let you access detailed recommendations while on the go.An Iranian Seder in Beverly Hills : Hallaq (Persian Charoset) : A recipe for Hallaq (Persian Charoset).Living Proof : The art of schnapps is thriving in the Austrian Alps.Speed Read for Tuesday, March 23 : Speed Read for Tuesday, March 23Nintendo to Make 3-D Version of Its DS Handheld Game : Unlike other 3D film and TV technologies, the new machine will not require users to wear special glasses.Paid Notice: Deaths  FOUST, EVERETT  : <!-- EVERETT  FOUST -->FOUST--Everett ""Alan"" age 64, of Leonia for 25 years, on March 20, 2010. He is survived by his wife of 38 years Catherine nee: Eardley. Devoted father to Cynthia and her husband Ronald Venner. His adored grandson Liam. Dear ..."
34,2010-05-07,"Nokia Adds iPad to Patent Suit Against Apple : The Finnish cellphone maker had already sued Apple over infringement of its patents involving the iPhone, which led Apple to countersue Nokia.Nokia Expands Patent Infringement Case to Ipads : The latest complaint follows other lawsuits by Nokia claiming that a broad swath of Apple products violate Nokia patents. What We're Reading: iPad Addicts : Memes, Facebook apps added secretly and iPad addiction lead the reading list.The Demise of Datebooks : Shelving analog calendars for digital ones. Volatile Week on Wall St. Ends With Another Slide : Turbulence continued to rock the equity markets on Friday, as Wall Street closed out one of its most volatile weeks since the financial crisis of 2008. Market regulators said that they had not yet determined the cause of Thursday's steep decline.Digital Wizardry in Children's Literature : There's a wealth of choices of e-books for children.Volatile Week on Wall St. Ends With Another Slide : Turbulence continued to rock the equity markets on Friday, as Wall Street closed out one of its most volatile weeks since the financial crisis of 2008. Market regulators said that they had not yet determined the cause of Thursday&#8217;s steep dec...Autodesk for the People : A couple of easy-to-use applications have helped Autodesk come out of the design shadows to sell directly to consumers.Complaint Box | Brittney, Brittny, Brittneigh : Giving one&#8217;s offspring odd, random or deliberately misspelled names is a form of mistreatment that also hurts the rest of society.Geriatric Delinquents, Rampaging Through Suburbia : Harmony Korine’s “Trash Humpers” follows the gleeful, gross exploits of a quartet of old degenerates."
35,2010-05-11,"Google-AdMob Deal Gets Extended Federal Review : The Federal Trade Commission wants to use the additional time, in part, to better understand the competitive effects of Apple’s purchase of Quattro Wireless, an AdMob rival.Shifting Fortunes of Cellphones : As voice becomes an afterthought, former handset leaders like Nokia and Motorola are suffering.A Software Fix for iPad Troubles : Wi-Fi woes for the iPad might need a software fix.Head of Nokia’s Mobile Phone Unit Is Leaving : The departure of Rick Simonson, who has been in the job for six months, comes amid Nokia’s second reorganization in less than a year.Pairings: White Sangria and Red Sangria : Sherry or dry white wine can be the foundation.White Sangria and Red Sangria : Cavas, often blessed with notes of citrus and spring blossoms, are genial sparkling wines, all the more so because of their modest prices. They can be called on for many occasions, and are the ideal finishing touch for sangria, either red or white...Manhattan Theater Club Announces 2010-2011 Productions : &#8220;The Pitmen Painters&#8221; and &#8220;Good People,&#8221; a new collaboration between David Lindsay-Abaire and Daniel Sullivan, will be presented by the theater company on Broadway.Manhattan Theater Club Announces 2010-2011 Productions : ""The Pitmen Painters"" and ""Good People,"" a new collaboration between David Lindsay-Abaire and Daniel Sullivan, will be presented by the theater company on Broadway.Sardine and Coleslaw Po’Boy : In this sandwich, crunchy shredded cabbage is topped with sardines, a great source of omega-3 fatty acids.A Peek at Vanity Fair's iPad App : A preview of Vanity Fair's iPad application."
36,2010-05-24,"Can Apple's Jobs Still Wow After Leaks? : Steven P. Jobs, Apple's chief executive, will make a presentation at next month's Apple developers' conference. But with all the leaks, will developers be wowed?Microsoft to Reorganize Consumer Products Unit : The company hopes new products and services will lure younger consumers.No iPads at Yankee Stadium : The stadium has a policy that prohibits fans from bringing laptops inside, and iPads are included in that ban.The 10 Biggest Choking Hazards : According to a 2008 study, the 10 foods that pose the highest choking hazards for young children are hot dogs, peanuts, carrots, boned chicken, candy, meat, popcorn, fish with bones, sunflower seeds and apples.      Dr. Gary Smith, the lead author...The 10 Biggest Choking Hazards : Hot dogs, peanuts and carrots top the list of biggest choking hazards for children. "
37,2010-05-25,"Apple Is Said to Face Inquiry About Online Music : The Justice Department is examining Apple’s tactics in the digital music market, according to several people.Hedge Funds Heart Apple : Which companies do hedge funds love most? According to Goldman Sachs's most recent quarterly Hedge Fund Monitor report, the answer is Apple, followed by Bank of America and Google.Hedge Funds Heart Apple : Which companies do hedge funds love most? According to Goldman Sachs&#8217;s most recent quarterly Hedge Fund Monitor report, the answer is Apple, followed by Bank of America and Google.Microsoft Shakes Up Its Consumer Products Unit : The chief executive, Steven Ballmer, will take a bigger role in developing the company’s games and gadgets as two executives depart.String of Suicides Continues at Electronics Supplier in China : A 19-year-old Foxconn employee was found dead, the ninth suicide this year at a factory operated by one of the world’s largest contract electronics manufacturers.German-Style Sweet Mustard : Microsoft to Reorganize Consumer Products Unit : The company hopes new products and services will lure younger consumers.German-Style Sweet Mustard  : A recipe from Radegast Hall, a Brooklyn beer garden.No iPads at Yankee Stadium : The stadium has a policy that prohibits fans from bringing laptops inside, and iPads are included in that ban.The 10 Biggest Choking Hazards : According to a 2008 study, the 10 foods that pose the highest choking hazards for young children are hot dogs, peanuts, carrots, boned chicken, candy, meat, popcorn, fish with bones, sunflower seeds and apples.      Dr. Gary Smith, the lead author..."
38,2010-05-26,"Apple Passes Microsoft as No. 1 in Tech : Apple, which had been given up for dead a decade ago, is now the world’s most valuable technology company.Apple's Struggle With Political Apps : Apple approved a Republican politician's app Wednesday after initially saying it was defamatory, the latest indication that the company is still feeling out its approach to political speech.Apple Struggles With Political Apps : The company is dealing with political candidates' requests for apps.Apple Said to Face Inquiry About Online Music : The Justice Department is examining Apple&#8217;s tactics in the market for digital music, and its staff members have talked to major music labels and Internet music companies, The New York Times reported.Apple Said to Face Inquiry About Online Music : The Justice Department is examining Apple's tactics in the market for digital music, and its staff members have talked to major music labels and Internet music companies, The New York Times reported.Apple and Microsoft's Tug of War : Apple shot past Microsoft to become the world’s most valuable technology company. Microsoft Shakes Up Its Consumer Products Unit : The chief executive, Steven Ballmer, will take a bigger role in developing the company’s games and gadgets as two executives depart.String of Suicides Continues at Electronics Supplier in China : A 19-year-old Foxconn employee was found dead, the ninth suicide this year at a factory operated by one of the world’s largest contract electronics manufacturers.An App That Makes Cards With Vivid Fonts : Since the lamented loss of The New Yorker's free electronic cards, you may have had a difficult time finding e-cards of the noncloying variety. Now, for $1.99, you can get a rack's worth on your iPhone.     An app called PixyMe lets you add words ...Wal-Mart Cuts the iPhone Price to $97 : Starting on Tuesday, Walmart is offering a 16 GB iPhone for $97 with a two-year AT&T contract or qualified upgrade."
39,2010-06-08,"On Newest iPhone, Another Camera : The new iPhone 4 will be available June 24 and is priced at $199 for the 16-gigabyte version and $299 for the 32-gigabyte version.Times Company Objects to News-Reader App : After a complaint from The New York Times Company, Apple removed a popular iPad news-reading application from its App Store. It was later reinstated.Thoughts From Tech Blogs on the iPhone 4 : The technology blogosphere weighs in on the iPhone 4. Although most bloggers like its new features, many are unhappy with the idea of another two years with AT&T.Uncertainty Leads to a Broad Decline : Just as the economy is searching for direction, the markets also seem to be groping for positive signs.     But with little in the way of economic data on Monday, traders found little to ease their concerns about Friday's jobs report and the debt ...Otarian : This fast-food restaurant caters to environmentally conscious vegetarians in Midtown and Greenwich Village.The Merchants That Don't Take Cash : A growing number won't accept green cash money. It's legal, and we name names of those who are turning cash away.As China’s Wages Rise, Export Prices Could Follow : Salary increases are expected to affect many stages of the supply chain, forcing companies to raise prices and possibly shift to higher-end goods.Energy and Chemical Companies Help Give the Market a Lift : Increases in energy and material shares helped to offset a down day for technology.At Ad Panel, Words of Wisdom, Some Carefully Chosen : Three leaders in the creative side of the advertising industry imparted their wisdom at a panel on Tuesday - part of a day-long event at the Museum of Modern Art in Midtown Manhattan, sponsored by the Association of Independent Commercial Producer...In New York, Local Meat Is Easier to Find
 : Boutique meat from animals raised on local fields seems to be everywhere around the city, from Greenmarkets to Fresh Direct."
40,2010-06-25,"Did Disguising the iPhone 4 Mask a Temperamental Antenna? : Could Apple have missed the antenna problem because the iPhone was kept cloaked when taken off campus?What We're Reading: Fake PR : Sergey Brin's search for a cure to Parkinson's and various analyses of iPhone 4 sales top the reading list.The Mystery of the iPhone Death Grip : Getting to the bottom of the mystery of the iPhone Death Grip.Twitter Settles F.T.C. Privacy Case : Twitter has settled a Federal Trade Commission investigation into the security and privacy protections it offers users.Twitter Settles F.T.C. Privacy Case : Twitter has settled a Federal Trade Commission investigation into the security and privacy protections it offers users.Michigan: Cereal Is Recalled : The Kellogg Company is voluntarily recalling about 28 million boxes of cereal because an unusual smell and flavor from the packages’ liners could make people ill.Friday Reading: Notification of a Building's Bedbug History : Notifications about a New York building's recent bedbug history, the lowest mortgage rates since the 1950s and other consumer-focused items from Friday's Times.Reading Music on the iPad : The iPad makes a surprisingly good reader for sheet music.An iPhone Q&A : A sampling of the questions readers are asking David Pogue about the new iPhone, with his replies.May Orders in Durables Fell Slightly : The overall trend, not counting orders for aircraft, showed that spending for those goods has improved."
41,2010-07-02,"Apple Acknowledges Flaw in iPhone Signal Meter : In response to complaints, Apple said it would fix the way the signal strength is displayed on the new iPhone. Apple Hopes to Re-enter the Living Room : Apple is exploring new alternatives to get content into the living room, according to people familiar with the company's plans.Apple Speaks on the Matter of the 'Death Grip' : Apple responded to consumer complaints about the so-called Death Grip that drops calls. It said it would fix the way the signal strength is displayed on the phone.Disney Buys Tapulous to Drive Mobile Strategy : The Walt Disney Company said on Thursday that it had bought Tapulous, a start-up company that makes music-based games for the iPhone, iPad and iPod Touch. Disney said Tapulous's co-founder and chief operating officer would lead its mobile business...Disney Buys Tapulous to Drive Mobile Strategy : The Walt Disney Company said on Thursday that it had bought Tapulous, a start-up company that makes music-based games for the iPhone, iPad and iPod Touch. Disney said Tapulous&#8217;s co-founder and chief operating officer would lead its mobile bu...Disney Buys Tapulous, Maker of Music Game Applications : The deal is a sign of the staying power of Apple’s mobile devices as game machines, analysts said.Let's Try to Make Sense of the 'Death Grip' : The iPhone 4 could go down in the history book as ""Weirdest Consumer Tech Bumble""The New iPhone's Other Performance Problem : Apple has has another apparently widespread problem with the iPhone 4: cut-off calls if you press the screen to your cheek.What We're Reading: Job Creation : How jobs were created in the industrial revolution and how they can be created now as well as Facebook fatigue and memo writing lessons are on this weekend's reading list.Morning Takeout : And in today's morning takeout:-Krugman's recession roller coaster-How animals + football make great money spinners.-Is Apple about to give us the iCar?"
